title;price;location;time;description
Maison et Villas location de vacances à Essaouira;;Essaouira;il y a 1 minute;Je propose charmante villa pour location de nuitées à Essaouira MogadorCalme et sécuriséBien équipéeSans vis à visBienvenue Cher client
personnelles de maison très compétent logée ou non;;Dar Bouazza;il y a 1 jour;smart clean service vous proposes des profiles expérimentés africaines, marocaines, philippines professionnelle parlant couramment l'anglais ou le Français sur tout le territoire marocains pour vos ta
IPTV VIP STABLE SPORT FILMS SERIES 4K FHD UHD;249 DH;Marrakech;il y a 5 minutes;Le meilleur service de télévision au meilleur prix…Achetez nos produits aujourd’hui et profitez de plus de 20.000 chaînes avec un abonnement de 1, 3, 6 ou 12 mois au meilleur prix sans contrat. P
Maison à Midelt 201m² au centre de la ville;2 200 000 DH;Midelt;il y a 7 minutes;une maison au centre de la ville . dans une région commerciale avec 2 façades ( près de la pharmacie moulay idris )
Employés de maison / ménage / nounous;2 500 DH;Kénitra;il y a 7 minutes;Bti24Services vous offre la possibilité d'avoir du personnel de qualité et professionnel a moindre cout. Nos profils sont de diverses nationalité et prêt a répondre a toutes vos exigences. Avec une mé
Maisons à vendre à Kénitra alliance mehdia;860 000 DH;Kénitra;il y a 12 minutes;Maison R+1 a vendre a alliance mehdia 2 seulement a 86 m et le prix négociable pour plus d’infos veuillez contacter nous L’offre limitée
Maison et Villas location de vacances à Marrakech;6 000 DH /Nuit;Marrakech;il y a 13 minutes;Le luxe et la royauté sont ce que vous méritez pour passer vos vacances.On vous propose cette magnifique pièce d'art, Dispose de 4 suite avec leurs dressing et salle de bain italiennes en ma
Maison et Villas location de vacances à Marrakech;5 500 DH /Nuit;Marrakech;il y a 13 minutes;VILLA SAPHIR MODERNE Découvrez un havre de paix au cœur de Marrakech avec notre villa moderne située sur l'avenue Mohamed 6. Cette magnifique propriété offre un cadre luxueux et contemporain
Maison et Villas location de vacances à Marrakech;1 500 DH /Nuit;Marrakech;il y a 13 minutes;Appartement a la location saisonnière de 2 chambre et salon, accès pour piscine
Maison et Villas location de vacances à Marrakech;5 500 DH /Nuit;Marrakech;il y a 14 minutes;Villa 5 suites au seins du golf ressort d’amelkis
Propriétés agricole à vendre;1 350 000 DH;Oujda;il y a 14 minutes;"Petite ferme à vendreÉquipée d'électricité ONEEau de puits à l'énergie solaire ""plaques photovoltaic""Maison de 120 m2Plantations : Olivier, Amandiers, citronniers et autres.Li"
Mercedes glc coupe 43 amg importé neuve;;Casablanca;il y a 15 minutes;Glc 43 AMG coupé fin 2017 1ere main importé neuve.1ere main.Peinture d'origine.Faible km (entretien maison).Toit.Distronic plus.Lane assist.Auto park.Hud.M
maison hy najd oujda;630 000 DH;Oujda;il y a 19 minutes;maison neuf 2fasades avandre hy najd 2prix négociable descute posebelete d'achat par banque cridit total
Maison à Salé;700 DH /Nuit;Salé;il y a 20 minutes;Découvrez un magnifique Riad marocain traditionnel à Salé, le luxe d'un véritable Riad marocain traditionnel avec de magnifiques chambres et une cour spacieuse Séjournez dans un 19ème siècle
Belle appartement de luxe au meilleur prix;;Casablanca;il y a 21 minutes;Un très bel appartement de standing de 79 m² dans une résidence sécurisée proche de toutes commodités telles que écoles, supermarchés, mosquées, zones de loisirs et transports. Il se compose de 3 cham
maison a vendre à mohammedia;1 700 000 DH;Mohammedia;il y a 22 minutes;Maison Titré R2 à vendre à hay farah ex les crêtes mohammedia près de Asswak Essalam avec 3 façades sur une Superficie de 77m2 composé de:rez-de-chaussée habitable avec garage et 1er et 2eme étage plu
Maison R plus 2 Commercial 320m² hay salam Rue 30;2 700 000 DH;El Jadida;il y a 22 minutes;jolie maison complet commercial dans secteur active en face RUE 30 contient un magazin commercial 3 rido et Contient 2 appartement et terrasse compse chaque appartetement 3 chambre avec placard salle
Appartement chic du palais doré à un prix choquant;;Casablanca;il y a 22 minutes;projet RIAD AL BERNOUSSI a récemment construit une maison neuve qui maintient ses standards, qu'il s'agisse d'une finition très soignée ou d'une architecture moderne et très chic, sans compromis sur l
Maison vendre a marrakech hay hassani r2;1 250 000 DH;Marrakech;il y a 22 minutes;Votre agence immobilier masterimmo marrakech vous propose maison vendre a marrakech hay hassani avec superficie de 76 m2 dans les papier et 83 m2 dans la maison . Compose : Rez de chausse :
Femmes de ménage nounou et cuisinière logée;;Fès;il y a 23 minutes;bonjour Mes dames et messieurs vous cherchez une aide maison ménage ou cuisine ou bien une personne polyvalente APPELEZ NOUS Vous aurez plusieurs explications dans ce domaine et découvriez n
cuisine normal avec ménage profond;;Temara;il y a 24 minutes;Mes dames et messieurs vous cherchez une aide maison ménage ou cuisine ou bien une personne polyvalente APPELEZ NOUS Vous aurez plusieurs explications dans ce domaine et découvriez nos prestation
vente ferme 100ha à Fès Séfrou;;Meknès;il y a 24 minutes;A VENDRE MEKNES ou vous serez associé gérant Maison d’hôte Fermette de 4500m² avec jolie maison de 150m² convient Maison d’hôte ou secondaire.Située en hauteur vue panoramique sur des milliers d’hecta
nounou ménage et repassage a domicile;;Casablanca;il y a 24 minutes;Smart Clean vous propose un divers personnel de Maison, hôtel, spa, café, restaurant, de nationalités sénégalaise, ivoiriennes, marocaine et Philippines :- Femmes de ménage-cuisinières-
Maisons et Villas à Sidi Rahal;2 200 000 DH;Sidi Rahal;il y a 24 minutes;Venez découvrir une magnifique Villa près de la plage de Sidi Rahal à 15 min de Casablanca Superbe Villa à vendre avec tout le confort moderne Caractéristiques :Terrain spaci
Femme domestique qui passe la nuit;;Casablanca;il y a 25 minutes;Smart Clean vous propose un divers personnel de Maison, hôtel, spa, café, restaurant, de nationalités sénégalaise, ivoiriennes, marocaine et Philippines :- Femmes de ménage-cuisinières-
Employé polyvalent;;Meknès;il y a 27 minutes;Bti24Services nous vous proposons des profils qualifiés a votre maison ou pour vos société , vos bureaux , restaurant...des femmes de ménage, nounou ou cuisinière ou bien polyvalente qui viennent des
gouvernante professionnelle polyvalente;;Salé;il y a 28 minutes;Smart Clean vous propose un divers personnel de Maison, hôtel, spa, café, restaurant, de nationalités sénégalaise, ivoiriennes, marocaine et Philippines :- Femmes de ménage-cuisinières-
Maisons à Deux facade;2 350 000 DH;Tanger;il y a 29 minutes;Une belle maison à deux facade à vendre à tanja balia, Neuf
CROSSLAND X 1ER MAIN;157 000 DH;Agadir;il y a 29 minutes;CROSSLAND X 1ERE MAIN Diesel 6cv 110cv dinJuillet 2019Suivi maison Opel.Tres bien equipee.Prix negociable.
marocaine ou subsaharienne aide maison polyvalente;;Casablanca;il y a 30 minutes;Smart Clean vous propose un divers personnel de Maison, hôtel, spa, café, restaurant, de nationalités sénégalaise, ivoiriennes, marocaine et Philippines :- Femmes de ménage- Nounous- Ga
Création Site d'agence Immobilière;10 000 DH;Casablanca;il y a 30 minutes;L'immobilier est un secteur qui, malgré sa nature traditionnelle, est en constante évolution grâce à la technologie. Les agences immobilières ont désormais compris que la présence numérique est essent
Maisons et Villas à vendre à Casablanca;2 400 000 DH;Casablanca;il y a 31 minutes;Je met en vente ma maison r2 plus une chambre et une deuxième cuisine au toitLa maison est ce situe dans un très bon emplacement près de tous commodités une vue sur le grand boulevard 2 mars pour
Maison R3 de 116m² en Vente à Tanger AHLAN;2 960 000 DH;Tanger;il y a 34 minutes;Salamje mets en vente une maison finie située a Lot Boulaiche a coté de AHLAN a quelque pats de Marjan route de Rabatla maison est composée de R3 avec une superficie de 116Mle terrain e
Très Belle Maison 3 façades à vendre à Tiznit;1 390 000 DH;Tiznit;il y a 35 minutes;à vendre : Très belle maison meublée à Tiznit au quartier CIFM (حي السعادة) à proximité du lycée Al Massira, dans un coin très calme, bien orientée 3 façades, composé de :RDC (80 m²) : Garage pou
Mercedes classe e coupe;;Rabat;il y a 38 minutes;je met en vente ma Mercedes classe e coupe importé neuve en très bon état, porte ventouse double tableau distronic plus et beaucoup d'autres options, entretient maison Mercedes depuis sa sortie
